StockCode,description,list_price,category,subcategory,unit_cost
23265,SET OF 3 WOODEN TREE DECORATIONS,1.4839016393442621,General,Retail,1.0387311475409835
23266,SET OF 3 WOODEN STOCKING DECORATION,1.454005934718101,General,Retail,1.0178041543026706
23267,SET OF 4 SANTA PLACE SETTINGS,1.4116216216216215,General,Retail,0.988135135135135
23268,SET OF 2 CERAMIC CHRISTMAS REINDEER,1.6910112359550562,General,Retail,1.1837078651685393
23269,SET OF 2 CERAMIC CHRISTMAS TREES,1.7109473684210526,General,Retail,1.1976631578947368
23270,SET OF 2 CERAMIC PAINTED HEARTS ,1.501171875,General,Retail,1.0508203125
23271,CHRISTMAS TABLE CANDLE SILVER SPIKE,1.0537735849056602,General,Retail,0.7376415094339621
23272,TREE T-LIGHT HOLDER WILLIE WINKIE,1.916818181818182,General,Retail,1.3417727272727273
23273,HEART T-LIGHT HOLDER WILLIE WINKIE,1.8786725663716815,General,Retail,1.3150707964601769
23274,STAR T-LIGHT HOLDER WILLIE WINKIE,2.0156666666666667,General,Retail,1.4109666666666667
23275,SET OF 3 HANGING OWLS OLLIE BEAK,1.4738323353293412,General,Retail,1.0316826347305388
23280,FOLDING BUTTERFLY MIRROR HOT PINK ,1.0603164556962026,General,Retail,0.7422215189873418
23281,FOLDING BUTTERFLY MIRROR RED  ,0.9803846153846153,General,Retail,0.6862692307692306
23282,FOLDING BUTTERFLY MIRROR IVORY ,1.255912408759124,General,Retail,0.8791386861313868
23283,DOORMAT VINTAGE LEAVES DESIGN ,8.65824034334764,General,Retail,6.060768240343347
23284,DOORMAT KEEP CALM AND COME IN,8.776284153005465,General,Retail,6.143398907103825
23285,PINK VINTAGE SPOT BEAKER,1.06703125,General,Retail,0.7469218750000001
23286,BLUE VINTAGE SPOT BEAKER,1.03009009009009,General,Retail,0.721063063063063
23287,RED VINTAGE SPOT BEAKER,1.03395,General,Retail,0.7237649999999999
23288,GREEN VINTAGE SPOT BEAKER,1.0418817204301074,General,Retail,0.7293172043010752
23289,DOLLY GIRL CHILDRENS BOWL,1.5367708333333334,General,Retail,1.0757395833333334
23290,SPACEBOY CHILDRENS BOWL,1.4357009345794394,General,Retail,1.0049906542056075
23291,DOLLY GIRL CHILDRENS CUP,1.5237244897959183,General,Retail,1.0666071428571429
23292,SPACE BOY CHILDRENS CUP,1.5313004484304933,General,Retail,1.0719103139013453
23293,SET OF 12 FAIRY CAKE BAKING CASES,1.0651805054151624,General,Retail,0.7456263537906136
23294,SET OF 6 SNACK LOAF BAKING CASES,1.089776536312849,General,Retail,0.7628435754189943
23295,SET OF 12 MINI LOAF BAKING CASES,1.1117555555555554,General,Retail,0.7782288888888887
23296,SET OF 6 TEA TIME BAKING CASES,1.524240837696335,General,Retail,1.0669685863874345
23297,SET 40 HEART SHAPE PETIT FOUR CASES,1.8389570552147239,General,Retail,1.2872699386503066
23298,SPOTTY BUNTING,5.519121447028423,General,Retail,3.863385012919896
23299,FOOD COVER WITH BEADS SET 2 ,4.370479452054795,General,Retail,3.0593356164383563
23300,GARDENERS KNEELING PAD CUP OF TEA ,1.9087597911227152,General,Retail,1.3361318537859006
23301,GARDENERS KNEELING PAD KEEP CALM ,1.9439673913043478,General,Retail,1.3607771739130434
23302,KNEELING MAT HOUSEWORK  DESIGN,1.8876394849785407,General,Retail,1.3213476394849784
23303,SET 4 PICNIC CUTLERY FONDANT,1.95,General,Retail,1.365
23304,SET 4 PICNIC CUTLERY CHERRY ,1.9500000000000002,General,Retail,1.365
23305,SET 4 PICNIC CUTLERY BLUEBERRY,1.9500000000000002,General,Retail,1.365
23306,SET OF 36 DOILIES PANTRY DESIGN,1.8061290322580643,General,Retail,1.264290322580645
23307,SET OF 60 PANTRY DESIGN CAKE CASES ,0.6839469578783152,General,Retail,0.4787628705148206
23308,SET OF 60 VINTAGE LEAF CAKE CASES ,0.6942159383033419,General,Retail,0.4859511568123393
23309,SET OF 60 I LOVE LONDON CAKE CASES ,0.7424170616113744,General,Retail,0.5196919431279621
23310,BUBBLEGUM RING ASSORTED,0.47804878048780486,General,Retail,0.3346341463414634
23311,VINTAGE CHRISTMAS STOCKING ,2.9656772334293944,General,Retail,2.075974063400576
23312,VINTAGE CHRISTMAS GIFT SACK,4.452293577981651,General,Retail,3.1166055045871555
23313,VINTAGE CHRISTMAS BUNTING,5.548627450980392,General,Retail,3.884039215686274
23314,VINTAGE CHRISTMAS TABLECLOTH,13.607881355932204,General,Retail,9.525516949152541
23315,IVORY REFECTORY CLOCK,10.776511627906977,General,Retail,7.543558139534883
23316,RED REFECTORY CLOCK ,11.109454545454545,General,Retail,7.776618181818181
23317,BLUE REFECTORY CLOCK ,11.226951219512195,General,Retail,7.858865853658536
23318,BOX OF 6 MINI VINTAGE CRACKERS,2.7416492146596863,General,Retail,1.9191544502617803
23319,BOX OF 6 MINI 50'S CRACKERS,2.651167883211679,General,Retail,1.855817518248175
23320,GIANT 50'S CHRISTMAS CRACKER,2.805680473372781,General,Retail,1.9639763313609466
23321,SMALL WHITE HEART OF WICKER,1.7480124223602485,General,Retail,1.223608695652174
23322,LARGE WHITE HEART OF WICKER,3.1351398601398603,General,Retail,2.194597902097902
23323,WHITE WICKER STAR ,2.251291390728477,General,Retail,1.5759039735099336
23324,RUSTIC STRAWBERRY JAMPOT LARGE ,2.209318181818182,General,Retail,1.5465227272727273
23325,RUSTIC STRAWBERRY JAMPOT SMALL,1.8145714285714285,General,Retail,1.2701999999999998
23326,HANGING MINI COLOURED BOTTLES,2.638026315789473,General,Retail,1.846618421052631
23327,HANGING CLEAR MINI BOTTLE,0.7871428571428571,General,Retail,0.5509999999999999
23328,SET 6 SCHOOL MILK BOTTLES IN CRATE,4.845672371638142,General,Retail,3.3919706601466992
23329,DECORATIVE WICKER HEART LARGE,1.7691199999999998,General,Retail,1.2383839999999997
23330,DECORATIVE WICKER HEART MEDIUM,1.3630044843049327,General,Retail,0.9541031390134528
23331,DECORATIVE WICKER HEART SMALL,0.781578947368421,General,Retail,0.5471052631578947
23332,IVORY WICKER HEART LARGE,1.7616891891891888,General,Retail,1.233182432432432
23333,IVORY WICKER HEART MEDIUM,1.3329218106995884,General,Retail,0.9330452674897118
23334,IVORY WICKER HEART SMALL,0.7883823529411764,General,Retail,0.5518676470588234
23335,EGG FRYING PAN IVORY ,2.3288659793814435,General,Retail,1.6302061855670102
23336,EGG FRYING PAN PINK ,2.604418604651163,General,Retail,1.8230930232558138
23337,EGG FRYING PAN MINT ,2.287971014492754,General,Retail,1.6015797101449276
23338,EGG FRYING PAN RED ,2.3390825688073393,General,Retail,1.6373577981651375
23339,EGG FRYING PAN BLUE ,2.511578947368421,General,Retail,1.7581052631578946
23340,VINTAGE CHRISTMAS CAKE FRILL,1.9589473684210525,General,Retail,1.3712631578947367
23341,PINK DINER WALL CLOCK,9.943057851239669,General,Retail,6.960140495867767
23342,MINT DINER WALL CLOCK,8.833496932515336,General,Retail,6.183447852760735
23343,JUMBO BAG VINTAGE CHRISTMAS ,2.417366255144033,General,Retail,1.692156378600823
23344,JUMBO BAG 50'S CHRISTMAS ,2.4177423822714683,General,Retail,1.6924196675900278
23345, DOLLY GIRL BEAKER,1.5064204545454545,General,Retail,1.054494318181818
23346,SPACEBOY BEAKER,1.5186559139784948,General,Retail,1.0630591397849463
23347,I LOVE LONDON BEAKER,1.5569387755102042,General,Retail,1.0898571428571429
23348,CHILDRENS TOY COOKING UTENSIL SET,2.5796470588235296,General,Retail,1.8057529411764706
23349,ROLL WRAP VINTAGE CHRISTMAS,1.5426530612244898,General,Retail,1.0798571428571428
23350,ROLL WRAP VINTAGE SPOT ,1.4612861736334404,General,Retail,1.0229003215434083
23351,ROLL WRAP 50'S CHRISTMAS,1.5103072625698326,General,Retail,1.0572150837988827
23352,ROLL WRAP 50'S RED CHRISTMAS ,1.511643192488263,General,Retail,1.058150234741784
23353,6 GIFT TAGS VINTAGE CHRISTMAS ,0.9988519637462235,General,Retail,0.6991963746223564
23354,6 GIFT TAGS 50'S CHRISTMAS ,0.9722121212121212,General,Retail,0.6805484848484848
23355,HOT WATER BOTTLE KEEP CALM,5.271557788944723,General,Retail,3.6900904522613063
23356,LOVE HOT WATER BOTTLE,6.205617283950618,General,Retail,4.343932098765432
23357,HOT WATER BOTTLE SEX BOMB,5.005242718446602,General,Retail,3.503669902912621
23358,HOT STUFF HOT WATER BOTTLE,4.198539325842697,General,Retail,2.9389775280898878
23359,SET OF 12 T-LIGHTS VINTAGE DOILEY,1.9862025316455696,General,Retail,1.3903417721518987
23360,SET 8 CANDLES VINTAGE DOILEY,2.0620689655172413,General,Retail,1.4434482758620688
23365,SET 12 COLOUR PENCILS LOVE LONDON,0.7943930635838151,General,Retail,0.5560751445086706
23366,SET 12 COLOURING PENCILS DOILY,0.8156565656565656,General,Retail,0.5709595959595959
23367,SET 12 COLOUR PENCILS SPACEBOY ,0.7566666666666667,General,Retail,0.5296666666666666
23368,SET 12 COLOUR PENCILS DOLLY GIRL ,0.784322033898305,General,Retail,0.5490254237288135
23369,SET 36 COLOUR PENCILS LOVE LONDON,1.4970542635658914,General,Retail,1.0479379844961239
23370,SET 36 COLOUR PENCILS DOILEY,1.538627450980392,General,Retail,1.0770392156862745
23371,SET 36 COLOUR PENCILS SPACEBOY ,1.5179032258064515,General,Retail,1.062532258064516
23372,SET 36 COLOUR PENCILS DOLLY GIRL,1.6135761589403974,General,Retail,1.1295033112582782
23373,VINTAGE CHRISTMAS PAPER GIFT BAG,0.9070999999999999,General,Retail,0.6349699999999999
23374,RED SPOT PAPER GIFT BAG,0.867175572519084,General,Retail,0.6070229007633587
23375,50'S CHRISTMAS PAPER GIFT BAG,0.9369902912621358,General,Retail,0.655893203883495
23376,PACK OF 12 VINTAGE CHRISTMAS TISSUE,0.5079245283018868,General,Retail,0.3555471698113208
23377,PACK OF 12 DOLLY GIRL TISSUES,0.5607462686567164,General,Retail,0.39252238805970147
23378,PACK OF 12 50'S CHRISTMAS TISSUES,0.46322404371584697,General,Retail,0.32425683060109284
23379,PACK OF 12 RED APPLE TISSUES,0.5376623376623376,General,Retail,0.3763636363636363
23380,PACK OF 12 VINTAGE DOILY TISSUES,0.48520325203252035,General,Retail,0.33964227642276423
23381,PACK OF 12 VINTAGE LEAF TISSUES ,0.4760493827160494,General,Retail,0.33323456790123457
23382,BOX OF 6 CHRISTMAS CAKE DECORATIONS,4.660950226244344,General,Retail,3.2626651583710404
23388,WOODLAND MINI BACKPACK,4.634285714285714,General,Retail,3.2439999999999998
23389,SPACEBOY MINI BACKPACK,4.531338912133891,General,Retail,3.1719372384937237
23390,DOLLY GIRL MINI BACKPACK,4.389759036144579,General,Retail,3.072831325301205
23391, I LOVE LONDON MINI BACKPACK,4.611363636363636,General,Retail,3.227954545454545
23392,SPACEBOY ROCKET LOLLY MAKERS,2.7042982456140354,General,Retail,1.8930087719298248
23393,HOME SWEET HOME CUSHION COVER ,4.481428571428571,General,Retail,3.1369999999999996
23394,POSTE FRANCE CUSHION COVER,4.954210526315789,General,Retail,3.467947368421052
23395,BELLE JARDINIERE CUSHION COVER,4.915592417061611,General,Retail,3.4409146919431275
23396,BUTTERFLY CUSHION COVER,4.802587064676617,General,Retail,3.3618109452736316
23397,FOOT STOOL HOME SWEET HOME ,11.573870967741934,General,Retail,8.101709677419354
23398,HANGING HEART BONHEUR,1.0450666666666666,General,Retail,0.7315466666666666
23399,HOME SWEET HOME HANGING HEART,1.1070085470085471,General,Retail,0.7749059829059829
23400,SHELF WITH 4 HOOKS HOME SWEET HOME,6.854074074074074,General,Retail,4.797851851851851
23401,RUSTIC MIRROR WITH LACE HEART,7.090361445783133,General,Retail,4.963253012048193
23402,HOME SWEEET HOME 3 PEG HANGER ,4.4525,General,Retail,3.1167499999999997
23403,LETTER HOLDER HOME SWEET HOME,4.374,General,Retail,3.0617999999999994
23404,HOME SWEET HOME BLACKBOARD,6.0208875739644965,General,Retail,4.214621301775147
23405,HOME SWEET HOME 2 DRAWER CABINET,5.985492957746479,General,Retail,4.189845070422535
23406,HOME SWEET HOME KEY HOLDER,7.10990990990991,General,Retail,4.976936936936937
23407,SET OF 2 TRAYS HOME SWEET HOME,10.68142857142857,General,Retail,7.4769999999999985
23408,PHOTO FRAME LINEN AND LACE SMALL,2.08,General,Retail,1.456
23409,PHOTO FRAME LINEN AND LACE LARGE,3.8148837209302324,General,Retail,2.6704186046511627
23410,CURIO CABINET LINEN AND LACE ,8.027777777777779,General,Retail,5.6194444444444445
23411, TRELLIS COAT RACK,5.844035087719298,General,Retail,4.090824561403509
23412,HEART MIRROR ANTIQUE WHITE,7.724415584415584,General,Retail,5.4070909090909085
23413,VINTAGE COFFEE GRINDER BOX,6.318275862068965,General,Retail,4.422793103448275
23414,ZINC BOX SIGN HOME,10.073749999999999,General,Retail,7.051624999999999
23415,HOME SWEET HOME HOOK,1.4517021276595745,General,Retail,1.0161914893617021
23416,CHAMBRE HOOK,1.7564,General,Retail,1.22948
23417,BATHROOM HOOK,1.5964285714285713,General,Retail,1.1175
23418,LAVENDER TOILETTE BOTTLE,2.562025316455696,General,Retail,1.793417721518987
23419,HOME SWEET HOME BOTTLE ,2.6725581395348836,General,Retail,1.8707906976744184
23420,PANTRY HOOK TEA STRAINER ,2.33625,General,Retail,1.635375
23421,PANTRY HOOK SPATULA,2.5148484848484847,General,Retail,1.7603939393939392
23422,PANTRY HOOK BALLOON WHISK ,2.777872340425532,General,Retail,1.9445106382978723
23423,PANTRY 3 HOOK ROLLING PIN HANGER,4.536969696969697,General,Retail,3.175878787878788
23424,GINGHAM RECIPE BOOK BOX,6.186740740740741,General,Retail,4.330718518518519
23425,STORAGE TIN HOME SWEET HOME,3.0989285714285715,General,Retail,2.16925
23426,METAL SIGN DROP YOUR PANTS,3.3344711538461542,General,Retail,2.3341298076923076
23427,STOOL HOME SWEET HOME ,12.967478260869566,General,Retail,9.077234782608695
23428,IVORY RETRO KITCHEN WALL CLOCK,9.915454545454546,General,Retail,6.940818181818182
23429,RED RETRO KITCHEN WALL CLOCK,8.887391304347826,General,Retail,6.2211739130434776
23430,BLUE RETRO KITCHEN WALL CLOCK,8.621111111111112,General,Retail,6.034777777777778
23431,NATURAL HANGING QUILTED HEARTS ,1.363918918918919,General,Retail,0.9547432432432432
23432,PRETTY HANGING QUILTED HEARTS,1.3654054054054052,General,Retail,0.9557837837837836
23433,HANGING QUILTED PATCHWORK APPLES,1.5002247191011233,General,Retail,1.0501573033707863
23434,3 RAFFIA RIBBONS 50'S CHRISTMAS ,0.8802,General,Retail,0.6161399999999999
23435,3 RAFFIA RIBBONS VINTAGE CHRISTMAS,0.8976767676767677,General,Retail,0.6283737373737374
23436,GIFT BAG LARGE VINTAGE CHRISTMAS,1.4442982456140352,General,Retail,1.0110087719298246
23437, 50'S CHRISTMAS GIFT BAG LARGE,1.4238931297709925,General,Retail,0.9967251908396947
23438, RED SPOT GIFT BAG LARGE,1.370183486238532,General,Retail,0.9591284403669723
23439,HAND WARMER RED LOVE HEART,2.2266262135922332,General,Retail,1.5586383495145633
23440,PAINT YOUR OWN EGGS IN CRATE,2.022,General,Retail,1.4153999999999998
23441,HAND PAINTED HANGING EASTER EGG,0.42,General,Retail,0.294
23442,12 HANGING EGGS HAND PAINTED,2.08,General,Retail,1.456
23444,Next Day Carriage,15.189873417721518,General,Retail,10.632911392405061
23445,ICE CREAM BUBBLES,0.8659803921568627,General,Retail,0.6061862745098039
23446,BLUE BUNNY EASTER EGG BASKET,1.5833333333333333,General,Retail,1.1083333333333332
23447,PINK BUNNY EASTER EGG BASKET,1.5999999999999999,General,Retail,1.1199999999999999
23448,CREAM BUNNY EASTER EGG BASKET,1.6499999999999997,General,Retail,1.1549999999999998
23449,SET OF 6 EASTER RAINBOW CHICKS,1.25,General,Retail,0.875
23451,SQUARE MINI PORTRAIT FRAME,2.273396226415094,General,Retail,1.591377358490566
23452,HEART MINI PORTRAIT FRAME,2.07183908045977,General,Retail,1.450287356321839
23453,OVAL  MINI PORTRAIT FRAME,1.9883673469387753,General,Retail,1.3918571428571427
23454,SET OF 3 MINI HANGING PORTRAITS,4.5190909090909095,General,Retail,3.1633636363636364
23455,SMALL PARLOUR PICTURE FRAME,2.867777777777778,General,Retail,2.0074444444444444
23456,MEDIUM PARLOUR PICTURE FRAME ,4.116666666666667,General,Retail,2.881666666666667
23457,LARGE PARLOUR PICTURE FRAME,5.109354838709678,General,Retail,3.5765483870967745
23458,DOLLY CABINET 3 DRAWERS ,14.95,General,Retail,10.464999999999998
23459,DOLLY CABINET 2 DRAWERS ,12.5,General,Retail,8.75
23460,SWEETHEART WALL TIDY ,9.900930232558139,General,Retail,6.930651162790697
23461,SWEETHEART BIRD HOUSE,4.551500000000001,General,Retail,3.1860500000000003
23462,ROCOCO WALL MIRROR WHITE,20.69695652173913,General,Retail,14.48786956521739
23463,VINTAGE ZINC WATERING CAN,11.206249999999999,General,Retail,7.8443749999999985
23464,VINTAGE ZINC WATERING CAN SMALL,6.2125,General,Retail,4.34875
23465,TUSCAN VILLA FEEDING STATION,8.77375,General,Retail,6.1416249999999994
23466,TUSCAN VILLA DOVECOTE,10.084444444444443,General,Retail,7.05911111111111
23467,VINTAGE ZINC PLANTER  ,4.366363636363636,General,Retail,3.056454545454545
23468,TUSCAN VILLA BIRD TABLE ,8.25,General,Retail,5.7749999999999995
23469,CARD HOLDER LOVE BIRD SMALL,4.643611111111111,General,Retail,3.2505277777777777
23470,CARD HOLDER LOVE BIRD LARGE ,6.810714285714286,General,Retail,4.7675
23471,SIX DRAWER OFFICE TIDY,10.162592592592592,General,Retail,7.1138148148148135
23472, NINE DRAWER OFFICE TIDY,16.09060606060606,General,Retail,11.263424242424241
23473,WOODLAND SMALL RED FELT HEART,0.9533333333333333,General,Retail,0.6673333333333332
23474,WOODLAND SMALL BLUE FELT HEART,1.0405263157894737,General,Retail,0.7283684210526316
23475,WOODLAND SMALL PINK FELT HEART,0.959032258064516,General,Retail,0.6713225806451611
23476,WOODLAND LARGE RED FELT HEART,1.4700000000000002,General,Retail,1.0290000000000001
23477,WOODLAND LARGE BLUE FELT HEART,1.7153846153846155,General,Retail,1.2007692307692308
23478,WOODLAND LARGE PINK FELT HEART,1.5130769230769232,General,Retail,1.0591538461538461
23479,WIRE EGG BASKET ,8.26659090909091,General,Retail,5.7866136363636365
23480,MINI LIGHTS WOODLAND MUSHROOMS,4.428761467889909,General,Retail,3.100133027522936
23481,PEARLISED IVORY HEART SMALL ,1.28125,General,Retail,0.896875
23482,PEARLISED IVORY HEART LARGE ,1.765897435897436,General,Retail,1.2361282051282052
23483,HANGING  BUTTERFLY T-LIGHT HOLDER,2.409054054054054,General,Retail,1.6863378378378377
23484,HEART TRELLISTRIPLE T-LIGHT HOLDER,3.673333333333334,General,Retail,2.5713333333333335
23485,BOTANICAL GARDENS WALL CLOCK ,24.791807228915662,General,Retail,17.354265060240962
23486,ANTIQUE HEART SHELF UNIT,17.8127027027027,General,Retail,12.46889189189189
23487,SWEET HEART CAKE CARRIER,10.365454545454545,General,Retail,7.2558181818181815
23489,"GARLAND, VINTAGE BELLS",3.221454545454545,General,Retail,2.2550181818181816
23490,T-LIGHT HOLDER HANGING LOVE BIRD,3.961287128712871,General,Retail,2.7729009900990094
23491,VINTAGE JINGLE BELLS HEART,8.462151898734177,General,Retail,5.923506329113923
23492,VINTAGE JINGLE BELLS WREATH,8.549285714285714,General,Retail,5.9845
23493,VINTAGE DOILY TRAVEL SEWING KIT,2.156320754716981,General,Retail,1.5094245283018866
23494,VINTAGE DOILY DELUXE SEWING KIT ,6.812864077669903,General,Retail,4.769004854368932
23495,SET OF 3 PANTRY WOODEN SPOONS,1.7221951219512195,General,Retail,1.2055365853658535
23496,PANTRY KITCHEN THERMOMETER ,1.562258064516129,General,Retail,1.0935806451612902
23497,CLASSIC CHROME BICYCLE BELL ,1.62365,General,Retail,1.136555
23498,CLASSIC BICYCLE CLIPS ,1.657941176470588,General,Retail,1.1605588235294115
23499,SET 12 VINTAGE DOILY CHALK ,0.4831858407079646,General,Retail,0.33823008849557523
23500,KEY RING BASEBALL BOOT ASSORTED ,1.3861764705882351,General,Retail,0.9703235294117645
23501,KEY RING BASEBALL BOOT UNION JACK,1.4955263157894738,General,Retail,1.0468684210526316
23502,PLAYING CARDS VINTAGE DOILEY ,1.3016842105263158,General,Retail,0.911178947368421
23503,PLAYING CARDS KEEP CALM & CARRY ON,1.279298245614035,General,Retail,0.8955087719298244
23504,PLAYING CARDS JUBILEE UNION JACK,1.3483410138248846,General,Retail,0.9438387096774191
23505,PLAYING CARDS I LOVE LONDON ,1.3546153846153848,General,Retail,0.9482307692307693
23506,MINI PLAYING CARDS SPACEBOY ,0.46264900662251657,General,Retail,0.3238543046357616
23507,MINI PLAYING CARDS BUFFALO BILL ,0.4734645669291338,General,Retail,0.3314251968503936
23508,MINI PLAYING CARDS DOLLY GIRL ,0.4665625,General,Retail,0.32659374999999996
23509,MINI PLAYING CARDS FUN FAIR ,0.4865151515151515,General,Retail,0.34056060606060606
23510,MINI PLAYING CARDS GYMKHANA,0.4972,General,Retail,0.34803999999999996
23511,EMBROIDERED RIBBON REEL EMILY ,2.3309090909090906,General,Retail,1.6316363636363633
23512,EMBROIDERED RIBBON REEL ROSIE,2.3164912280701753,General,Retail,1.6215438596491225
23513,EMBROIDERED RIBBON REEL SUSIE ,2.306,General,Retail,1.6141999999999999
23514,EMBROIDERED RIBBON REEL SALLY ,2.349189189189189,General,Retail,1.6444324324324324
23515,EMBROIDERED RIBBON REEL DAISY ,2.3925,General,Retail,1.67475
23516,EMBROIDERED RIBBON REEL SOPHIE  ,3.848181818181818,General,Retail,2.6937272727272727
23517,EMBROIDERED RIBBON REEL REBECCA ,3.4480952380952385,General,Retail,2.413666666666667
23518,EMBROIDERED RIBBON REEL RACHEL ,3.0959090909090907,General,Retail,2.1671363636363634
23519,EMBROIDERED RIBBON REEL CLAIRE,4.484583333333333,General,Retail,3.139208333333333
23520,EMBROIDERED RIBBON REEL RUBY ,3.9675,General,Retail,2.7772499999999996
23521,CAT AND BIRD WALL ART,4.204090909090909,General,Retail,2.942863636363636
23522,DOG AND BALL WALL ART,3.680625,General,Retail,2.5764375
23523,TREASURE AHOY WALL ART,3.9346341463414634,General,Retail,2.754243902439024
23524,HORSE & PONY WALL ART,4.323968253968254,General,Retail,3.026777777777778
23525,BUFFALO BILL WALL ART ,4.1639622641509435,General,Retail,2.91477358490566
23526,DOG LICENCE WALL ART,8.24888888888889,General,Retail,5.774222222222223
23527,ANIMALS AND NATURE WALL ART,3.998125,General,Retail,2.7986874999999998
23528,SPACEBOY WALL ART,4.7792,General,Retail,3.34544
23529,DOLLY GIRL WALL ART,4.338648648648649,General,Retail,3.037054054054054
23530,WALL ART ONLY ONE PERSON ,5.577586206896552,General,Retail,3.9043103448275858
23531,WALL ART BIG LOVE ,7.661681415929204,General,Retail,5.363176991150442
23532,WALL ART WORK REST AND PLAY  ,5.301612903225807,General,Retail,3.7111290322580643
23533,WALL ART GARDEN HAVEN ,6.166944444444445,General,Retail,4.316861111111111
23534,STOP FOR TEA WALL ART,7.53896551724138,General,Retail,5.277275862068965
23535,BICYCLE SAFTEY WALL ART,7.446898148148148,General,Retail,5.212828703703703
23536,VILLAGE SHOW WALL ART,6.794705882352942,General,Retail,4.75629411764706
23537,I LOVE LONDON WALL ART,6.9405882352941175,General,Retail,4.858411764705882
23538,WALL ART VINTAGE HEART,5.7790625,General,Retail,4.04534375
23539,WALL ART LOVES' SECRET ,6.594047619047619,General,Retail,4.615833333333333
23540,WALL ART THE MAGIC FOREST ,8.424285714285714,General,Retail,5.896999999999999
23541,WALL ART CLASSIC PUDDINGS ,9.71203947368421,General,Retail,6.798427631578948
23542,70'S ALPHABET WALL ART,9.784157303370787,General,Retail,6.84891011235955
23543,KEEP CALM WALL ART ,8.530952380952382,General,Retail,5.971666666666667
23544,WALL ART MID CENTURY MODERN ,7.523000000000001,General,Retail,5.2661
23545,WRAP RED DOILEY,0.41905882352941176,General,Retail,0.2933411764705882
23546,WRAP PAISLEY PARK ,0.42,General,Retail,0.294
23547,WRAP FLOWER SHOP  ,0.42,General,Retail,0.294
23548,WRAP MAGIC FOREST ,0.42,General,Retail,0.294
23549,WRAP BIRD GARDEN ,0.42,General,Retail,0.294
23550,WRAP ALPHABET POSTER  ,0.41875,General,Retail,0.29312499999999997
23551,PACK OF 12 PAISLEY PARK TISSUES ,0.5168115942028985,General,Retail,0.3617681159420289
23552,BICYCLE PUNCTURE REPAIR KIT ,2.2640650406504066,General,Retail,1.5848455284552845
23553,LANDMARK FRAME CAMDEN TOWN ,13.30220588235294,General,Retail,9.311544117647058
23554,LANDMARK FRAME OXFORD STREET,13.047017543859647,General,Retail,9.132912280701753
23555,LANDMARK FRAME NOTTING HILL ,12.897450980392156,General,Retail,9.028215686274509
23556,LANDMARK FRAME COVENT GARDEN ,12.61811320754717,General,Retail,8.832679245283018
23557,LANDMARK FRAME BAKER STREET ,13.181875,General,Retail,9.2273125
23558,LANDMARK FRAME LONDON BRIDGE ,13.125384615384615,General,Retail,9.187769230769229
23559,WOODLAND BUNNIES LOLLY MAKERS,2.8688709677419357,General,Retail,2.0082096774193547
23560,SET OF 6 RIBBONS COUNTRY STYLE,3.543846153846154,General,Retail,2.4806923076923075
23561,SET OF 6 RIBBONS PARTY,3.40875,General,Retail,2.386125
23562,SET OF 6 RIBBONS PERFECTLY PRETTY  ,3.2853488372093027,General,Retail,2.2997441860465115
23564,EGG CUP MILKMAID INGRID,1.7567105263157894,General,Retail,1.2296973684210526
23565,EGG CUP MILKMAID HELGA ,1.8453968253968254,General,Retail,1.2917777777777777
23566,EGG CUP MILKMAID HEIDI,1.769759036144578,General,Retail,1.2388313253012047
23567,EGG CUP HENRIETTA HEN PINK,1.823157894736842,General,Retail,1.2762105263157895
23568,EGG CUP HENRIETTA HEN CREAM ,1.7454166666666666,General,Retail,1.2217916666666666
23569,TRADTIONAL ALPHABET STAMP SET,5.3034693877551025,General,Retail,3.7124285714285716
23570,TRADITIONAL PICK UP STICKS GAME ,1.431118881118881,General,Retail,1.0017832167832168
23571,TRADITIONAL NAUGHTS & CROSSES,1.8921374045801527,General,Retail,1.3244961832061068
23574,PACKING CHARGE,7.5,General,Retail,5.25
23575,SNACK TRAY PAISLEY PARK,2.5823529411764703,General,Retail,1.8076470588235292
23576,SNACK TRAY RED VINTAGE DOILY,2.4010526315789473,General,Retail,1.680736842105263
23578,SNACK TRAY RED GINGHAM,2.417142857142857,General,Retail,1.6919999999999997
23579,SNACK TRAY I LOVE LONDON,2.6265714285714283,General,Retail,1.8385999999999998
23580,SNACK TRAY HAPPY FOREST  ,2.2116,General,Retail,1.5481199999999997
23581,JUMBO BAG PAISLEY PARK,2.256289855072464,General,Retail,1.579402898550725
23582,VINTAGE DOILY JUMBO BAG RED ,2.2147709923664123,General,Retail,1.5503396946564885
23583,LUNCH BAG PAISLEY PARK  ,1.8020481927710843,General,Retail,1.2614337349397589
23597,PAPER BUNTING PAISLEY PARK,3.186129032258065,General,Retail,2.2302903225806454
23598,PAPER BUNTING VINTAGE PARTY,3.2351063829787234,General,Retail,2.2645744680851063
23601,SET 10 CARDS SNOWY SNOWDROPS  17100,2.49,General,Retail,1.743
23602,SET 10 CARDS 3 WISE MEN 17107,2.91,General,Retail,2.037
23603,SET 10 CARD KRAFT REINDEER 17084,2.4899999999999998,General,Retail,1.7429999999999997
23604,SET 10 MINI SANTA & SNOWMAN  17087,1.66,General,Retail,1.162
23605,SET 10 CARDS 12 DAYS OF XMAS 17059,2.91,General,Retail,2.037
23607,SET 10 CARDS HATS & STOCKINGS 17081,1.66,General,Retail,1.162
23608,SET 10 CARDS RUDOLPHS NOSE 17097,2.91,General,Retail,2.037
