StockCode,description,list_price,category,subcategory,unit_cost
79030D,"TUMBLER, BAROQUE",2.0401639344262295,General,Retail,1.4281147540983605
79030G,"TUMBLER, NEW ENGLAND",2.9666942148760334,General,Retail,2.076685950413223
79051A,SMOKEY GREY COLOUR D.O.F. GLASS,0.73,General,Retail,0.511
79051a,SMOKEY GREY COLOUR D.O.F. GLASS,6.04,General,Retail,4.228
79062D,"RETRO TIN ASHTRAY,REVOLUTIONARY",0.38,General,Retail,0.26599999999999996
79063C,"RETRO PILL BOX KEY CHAIN,THE KING",0.18928571428571428,General,Retail,0.13249999999999998
79063D,"RETRO PILL BOX , REVOLUTIONARY",0.21,General,Retail,0.147
79065A,TEATIME ROUND CAKE TINS ,9.95,General,Retail,6.964999999999999
79066K,RETRO MOD TRAY,1.0829460580912864,General,Retail,0.7580622406639005
79066k,RETRO MOD TRAY,1.645,General,Retail,1.1515
79067,CORONA MEXICAN TRAY,4.938517587939699,General,Retail,3.4569623115577888
79070b,ENGLISH ROSE SQUARE CAKE TINS,11.26,General,Retail,7.882
79071B,ENGLISH ROSE METAL WASTE BIN,3.1742424242424243,General,Retail,2.2219696969696967
79072,TEATIME CAKE TIN WITH HANDLE,12.714485981308412,General,Retail,8.900140186915888
79140,ASS WINDPROOF MARIJUANA LIGHTERS,0.42,General,Retail,0.294
79144B,PAINTED LIGHTBULB STAR+ MOON,0.6481521739130435,General,Retail,0.4537065217391304
79144C,PAINTED LIGHTBULB RAINBOW DESIGN,0.7314432989690722,General,Retail,0.5120103092783506
79149B,SILICON STAR BULB  BLUE,0.42,General,Retail,0.294
79151B,"SILICON CUBE 25W, BLUE",0.42,General,Retail,0.294
79157B,UBO-LIGHT TRIOBASE BLUE,0.85,General,Retail,0.595
79157V,UBO-LIGHT TRIOBASE PURPLE,0.85,General,Retail,0.595
79160,HEART SHAPE WIRELESS DOORBELL,2.515767441860465,General,Retail,1.7610372093023254
79161A,ST GEORGE SET OF 10 PARTY LIGHTS,2.95,General,Retail,2.065
79163,BLACK CHAMPAGNE GLASS,2.532769230769231,General,Retail,1.7729384615384616
79164,BLACK WINE GLASS,6.560434782608695,General,Retail,4.5923043478260865
79172D,PURPLE TINT ACRYLIC FLOWER VASE,0.85,General,Retail,0.595
79190A,RETRO PLASTIC 70'S TRAY,0.577983193277311,General,Retail,0.40458823529411764
79190B,RETRO PLASTIC POLKA TRAY,0.539264705882353,General,Retail,0.3774852941176471
79190D,RETRO PLASTIC DAISY TRAY,0.5636607142857143,General,Retail,0.3945625
79191B,RETRO PLASTIC POLKA TRAY,1.0322857142857143,General,Retail,0.7225999999999999
79191C,RETRO PLASTIC ELEPHANT TRAY,0.9820253164556961,General,Retail,0.6874177215189873
79191D,RETRO PLASTIC DAISY TRAY,1.2092857142857143,General,Retail,0.8464999999999999
79192A,RETRO PLASTIC 70'S TRAY,1.4317142857142857,General,Retail,1.0022
79301,FEATHER HEART LIGHTS,2.95,General,Retail,2.065
79302M,"ART LIGHTS,FUNK MONKEY",3.6983333333333337,General,Retail,2.5888333333333335
79302m,"ART LIGHTS,FUNK MONKEY",5.9425,General,Retail,4.15975
79303A,WHITE ROHMBIC BLOCK TABLE LAMP,2.95,General,Retail,2.065
79303B,BLUE STAR BLOCK TABLE LAMP,4.752000000000001,General,Retail,3.3264000000000005
79303D,LILAC FLOWER BLOCK TABLE LAMP,4.860526315789474,General,Retail,3.4023684210526315
79308B,MOSAIC CANDLE DISH BLUE PURPLE,0.85,General,Retail,0.595
79315W,FLYING SAUCER TABLE LIGHT IN WHITE,4.3561538461538465,General,Retail,3.0493076923076923
79320, FLAMINGO LIGHTS,5.884066666666667,General,Retail,4.118846666666666
79321,CHILLI LIGHTS,6.290666082383875,General,Retail,4.403466257668712
79323B,BLACK CHERRY LIGHTS,7.727241379310345,General,Retail,5.409068965517242
79323G,GOLD  CHERRY LIGHTS,7.712295081967213,General,Retail,5.3986065573770485
79323GR,GREEN CHERRY LIGHTS,7.097469879518073,General,Retail,4.9682289156626505
79323LP,LIGHT PINK CHERRY LIGHTS,6.871764705882353,General,Retail,4.810235294117647
79323P,PINK CHERRY LIGHTS,7.28390977443609,General,Retail,5.098736842105263
79323S, SILVER CHERRY LIGHTS,7.9071428571428575,General,Retail,5.535
79323W, WHITE CHERRY LIGHTS,7.03,General,Retail,4.921
79328,BLUE FLOCK GLASS CANDLEHOLDER,1.4888235294117647,General,Retail,1.0421764705882353
79329,PINK FLOCK GLASS CANDLEHOLDER,1.2871428571428571,General,Retail,0.9009999999999999
79331,PINK FLOCK GLASS CANDLEHOLDER,1.3677777777777775,General,Retail,0.9574444444444442
79336,LIGHT PINK FLOCK GLASS CANDLEHOLDER,1.4557142857142857,General,Retail,1.019
79337,BLUE FLOCK GLASS CANDLEHOLDER,1.0266666666666666,General,Retail,0.7186666666666666
79338,DARK PINK FLOCK GLASS CANDLEHOLDER,1.4692307692307693,General,Retail,1.0284615384615385
79341,WILLOW BRANCH LIGHTS.,8.0465,General,Retail,5.632549999999999
79342B,BROWN FLOWER LIGHTS,8.726470588235294,General,Retail,6.108529411764706
79342b,BROWN FLOWER LIGHTS,13.57,General,Retail,9.498999999999999
79403,FROSTED WHITE BASE ,1.1430555555555555,General,Retail,0.8001388888888888
79406,FROSTED WHITE BASE ,0.3961904761904762,General,Retail,0.2773333333333333
79413,GLASS WINE GLASS DECORATIONS,1.25,General,Retail,0.875
79532,MOSAIC GLASS BALL CANDLEHOLDER,1.25,General,Retail,0.875
79534,MULTICOLOUR GLASS PLATE,0.55,General,Retail,0.385
81950B,FLOWER BLUE CLOCK W/SUCKER,0.9374285714285715,General,Retail,0.6562
81950V,FLOWER PURPLE CLOCK W/SUCKER,0.6972727272727273,General,Retail,0.4880909090909091
81952B,ROUND BLUE CLOCK W/SUCKER,0.7045,General,Retail,0.49315
81952V,ROUND PURPLE CLOCK W/SUCKER,0.7021276595744681,General,Retail,0.49148936170212765
81953B,ROUND ARTICULATED BLUE CLOCK W/SUCK,0.4375,General,Retail,0.30624999999999997
81953P,ROUND ARTICULATED PINK CLOCK W/SUCK,0.52,General,Retail,0.364
81985A,"ICON ALARM CLOCK,FUSCHIA  PIN UP",2.55,General,Retail,1.7849999999999997
82001S,VINYL RECORD FRAME SILVER,4.256120689655172,General,Retail,2.9792844827586205
82001s,VINYL RECORD FRAME SILVER,7.47103448275862,General,Retail,5.229724137931034
82011A,"BATHROOM SCALES, TROPICAL BEACH",4.359705882352941,General,Retail,3.0517941176470584
82011B,BATHROOM SCALES RUBBER DUCKS,4.251041666666667,General,Retail,2.9757291666666665
82011C,BATHROOM SCALES FOOTPRINTS IN SAND,5.237887323943662,General,Retail,3.666521126760563
82011E,"BATHROOM SCALES, FAG BREAK",3.75,General,Retail,2.625
82069,BEECH WOOD P/FRAME,6.275454545454545,General,Retail,4.392818181818181
82072,WHITE WOOD SINGLE P/FRAME,1.25,General,Retail,0.875
82076,BEECH WOOD PHOTO FRAME ,2.726842105263158,General,Retail,1.9087894736842106
82081,PINK HEARTS PHOTO ALBUM,5.259130434782609,General,Retail,3.681391304347826
82093,HEART SHAPE BUTTON FRAME ,3.1478571428571427,General,Retail,2.2034999999999996
82095,HEART BUTTONS JEWELLERY BOX,6.192916666666666,General,Retail,4.335041666666666
82482,WOODEN PICTURE FRAME WHITE FINISH,2.924807502467917,General,Retail,2.0473652517275416
82483,WOOD 2 DRAWER CABINET WHITE FINISH,6.514496466431095,General,Retail,4.560147526501766
82484,WOOD BLACK BOARD ANT WHITE FINISH,7.810832625318607,General,Retail,5.4675828377230244
82486,WOOD S/3 CABINET ANT WHITE FINISH,8.635784161490683,General,Retail,6.045048913043478
82494L,WOODEN FRAME ANTIQUE WHITE ,3.2012643678160924,General,Retail,2.2408850574712647
82494l,WOODEN FRAME ANTIQUE WHITE ,8.21860465116279,General,Retail,5.753023255813953
82545A,COGNAC AUX OEUFS METAL 1 HOOK,1.25,General,Retail,0.875
82551,LAUNDRY 15C METAL SIGN,1.6683046357615894,General,Retail,1.1678132450331125
82552,WASHROOM METAL SIGN,1.5468875,General,Retail,1.0828212499999998
82553,POP'S GREASY SPOON METAL SIGN,2.5773809523809526,General,Retail,1.8041666666666667
82567,"AIRLINE LOUNGE,METAL SIGN",2.17200408997955,General,Retail,1.5204028629856847
82578,KITCHEN METAL SIGN,0.7130898876404494,General,Retail,0.4991629213483146
82580,BATHROOM METAL SIGN,0.7649147516679022,General,Retail,0.5354403261675316
82581,TOILET METAL SIGN,0.6903583061889251,General,Retail,0.48325081433224754
82582,AREA PATROLLED METAL SIGN,2.3533042394014965,General,Retail,1.6473129675810474
82583,HOT BATHS METAL SIGN,2.760100166944908,General,Retail,1.9320701168614356
82585,SWEET VALENCIA CANDLE+CUP,1.8791836734693876,General,Retail,1.3154285714285712
82587,TEXRIO TOMATOES CANDLE+CUP,1.4558536585365853,General,Retail,1.0190975609756097
82597,BOMBS AWAY METAL SIGN,2.577926267281106,General,Retail,1.804548387096774
82599,FANNY'S REST STOPMETAL SIGN,2.7062035225048926,General,Retail,1.8943424657534247
82600,NO SINGING METAL SIGN,2.4013576158940397,General,Retail,1.6809503311258278
82605,OLD DOC.RUSSEL METAL SIGN,2.3973809523809524,General,Retail,1.6781666666666666
82607A,GLASS BONBON JAR PARFUME AUX FLEURE,1.8113207547169812,General,Retail,1.2679245283018867
82607C,GLASS BONBON JAR. SUPERFINES,1.901627906976744,General,Retail,1.3311395348837207
82607E,GLASS BONBON JAR. D'AMANDES,1.25,General,Retail,0.875
82613A,"METAL SIGN,CUPCAKE SINGLE HOOK",1.6133620689655173,General,Retail,1.129353448275862
82613B,"METAL SIGN,CUPCAKE SINGLE HOOK",1.724170403587444,General,Retail,1.2069192825112107
82613C,"METAL SIGN,CUPCAKE SINGLE HOOK",1.7389304812834225,General,Retail,1.2172513368983957
82613D,METAL SIGN CUPCAKE SINGLE HOOK,1.688450184501845,General,Retail,1.1819151291512913
82613a,"METAL SIGN,CUPCAKE SINGLE HOOK",2.493333333333333,General,Retail,1.7453333333333332
82613b,"METAL SIGN,CUPCAKE SINGLE HOOK",2.5009090909090905,General,Retail,1.7506363636363633
82613c,"METAL SIGN,CUPCAKE SINGLE HOOK",2.5016666666666665,General,Retail,1.7511666666666663
82615,PINK MARSHMALLOW SCARF KNITTING KIT,3.277444444444445,General,Retail,2.294211111111111
82616A,BUBBLE GUM SCARF KNITTING KIT,2.9890384615384615,General,Retail,2.092326923076923
82616B,FRAPPUCINO SCARF KNITTING KIT,2.211796875,General,Retail,1.5482578125
82616C,MIDNIGHT GLAMOUR SCARF KNITTING KIT,2.1964084507042254,General,Retail,1.5374859154929577
84006,MAGIC TREE -PAPER FLOWERS,1.1082075471698114,General,Retail,0.7757452830188679
84007,MAGIC GARDEN MOUNT FUJI,2.6815384615384614,General,Retail,1.8770769230769229
84012,MAGIC SHEEP WOOL GROWING FROM PAPER,1.7253333333333334,General,Retail,1.2077333333333333
84016,FLAG OF ST GEORGE CAR FLAG,53.19758064516129,General,Retail,37.2383064516129
84029C,BROWN FURRY HOT WATER BOTTLE,4.5562499999999995,General,Retail,3.1893749999999996
84029D,LEOPARD PRINT HOT WATER BOTTLE,4.223333333333334,General,Retail,2.9563333333333333
84029E,RED WOOLLY HOTTIE WHITE HEART.,4.464668959587274,General,Retail,3.1252682717110916
84029G,KNITTED UNION FLAG HOT WATER BOTTLE,4.793914728682171,General,Retail,3.355740310077519
84029c,BROWN FURRY HOT WATER BOTTLE,7.78,General,Retail,5.446
84030B,KNITTED POM POM HOT WATER BOTTLE,3.75,General,Retail,2.625
84030C,KNITTED RAINBOW HOT WATER BOTTLE,4.421666666666667,General,Retail,3.0951666666666666
84030E,ENGLISH ROSE HOT WATER BOTTLE,4.866748466257669,General,Retail,3.4067239263803684
84030b,KNITTED POM POM HOT WATER BOTTLE,8.46,General,Retail,5.922000000000001
84030c,KNITTED RAINBOW HOT WATER BOTTLE,7.718461538461539,General,Retail,5.402923076923077
84030e,ENGLISH ROSE HOT WATER BOTTLE,8.486326530612244,General,Retail,5.94042857142857
84031A,CHARLIE+LOLA RED HOT WATER BOTTLE ,4.696772151898735,General,Retail,3.287740506329114
84031B,CHARLIE LOLA BLUE HOT WATER BOTTLE ,4.701090909090909,General,Retail,3.290763636363636
84031a,CHARLIE+LOLA RED HOT WATER BOTTLE ,16.63,General,Retail,11.640999999999998
84031b,CHARLIE LOLA BLUE HOT WATER BOTTLE ,16.63,General,Retail,11.640999999999998
84032A,CHARLIE+LOLA PINK HOT WATER BOTTLE,3.3137987987987993,General,Retail,2.3196591591591593
84032B,CHARLIE + LOLA RED HOT WATER BOTTLE,3.087963576158941,General,Retail,2.1615745033112583
84033,FLAG OF ST GEORGE ,3.4215999999999998,General,Retail,2.3951199999999995
84050,PINK HEART SHAPE EGG FRYING PAN,2.1541551246537396,General,Retail,1.5079085872576177
84051,ASS COLOUR GLOWING TIARAS,0.8963934426229508,General,Retail,0.6274754098360655
84077,WORLD WAR 2 GLIDERS ASSTD DESIGNS,0.2831213307240704,General,Retail,0.1981849315068493
84078A,SET/4 WHITE RETRO STORAGE CUBES ,45.85689024390244,General,Retail,32.09982317073171
84081,WHITE CERAMIC PARTY SET (5PCS),5.212000000000001,General,Retail,3.6484
84086B,YELLOW/BLUE RETRO RADIO,2.95,General,Retail,2.065
84086C,PINK/PURPLE RETRO RADIO,3.2385227272727275,General,Retail,2.266965909090909
84192,ASSORTED COLOUR METAL CAT ,1.2402564102564102,General,Retail,0.8681794871794871
84199,GLOW IN DARK DOLPHINS,0.22138888888888889,General,Retail,0.1549722222222222
84201B,HAPPY BIRTHDAY CARD STRIPEY TEDDY,0.19,General,Retail,0.13299999999999998
84201C,HAPPY BIRTHDAY CARD TEDDY/CAKE,0.19000000000000003,General,Retail,0.133
84205C,HAPPY BIRTHDAY GINGER CAT CARD,0.19,General,Retail,0.13299999999999998
84206A,3 BLACK CATS W HEARTS BLANK CARD,0.19,General,Retail,0.13299999999999998
84206B,CAT W SUNGLASSES BLANK CARD,0.19,General,Retail,0.13299999999999998
84206C,CHAMPAGNE TRAY BLANK CARD,0.19,General,Retail,0.13299999999999998
84212,"ASSORTED FLOWER COLOUR ""LEIS""",0.8430935251798561,General,Retail,0.5901654676258993
84218,BOX/12 CHICK & EGG IN BASKET,2.0510204081632653,General,Retail,1.4357142857142855
84219,BOX/12 MOTHER & CHICK IN BASKET/BOW,2.5967857142857143,General,Retail,1.8177499999999998
84226,HEN HOUSE W FAMILY IN BARN & NEST,0.8383333333333334,General,Retail,0.5868333333333333
84227,HEN HOUSE W CHICK IN NEST,0.42,General,Retail,0.294
84228,HEN HOUSE W CHICK STANDING,0.6284782608695653,General,Retail,0.4399347826086957
84231,EASTER BUNNY WITH BASKET ON BACK,0.8629411764705882,General,Retail,0.6040588235294118
84247C,PACK/12 BLUE REINDEER CARD,2.95,General,Retail,2.065
84247E,PACK/12 XMAS FUN CARD,2.8541666666666665,General,Retail,1.9979166666666663
84247G,"DECOUPAGE,GREETING CARD,",0.48644859813084107,General,Retail,0.3405140186915887
84247H,PACK/12 DECOUPAGE CARD,2.317,General,Retail,1.6219000000000001
84247J,PACK/12 RUSSIAN DOLL CARDS,1.3244444444444445,General,Retail,0.9271111111111111
84247K,"FOLK ART GREETING CARD,pack/12",3.2764285714285717,General,Retail,2.2935
84247L,FAWN AND MUSHROOM GREETING CARD,0.5278181818181817,General,Retail,0.3694727272727272
84247N,PACK/12 BLUE FOLKART CARDS,2.3926415094339624,General,Retail,1.6748490566037735
84249A,"GREETING CARD,SQUARE, DOUGHNUTS",0.6129411764705882,General,Retail,0.4290588235294117
84249D,FAIRY CAKE GREETINGS CARD,0.4790625,General,Retail,0.33534375
84250M,"GREETING CARD, BLACKPOOL ROCK",0.7992307692307693,General,Retail,0.5594615384615385
84251B,"GREETING CARD, STICKY GORDON",0.3998360655737705,General,Retail,0.2798852459016393
84251C,"GREETING CARD, TWO SISTERS.",0.43830188679245285,General,Retail,0.30681132075471695
84251F,"GREETING CARD, RITA",0.4414,General,Retail,0.30898
84251G,"GREETING CARD, OVERCROWDED POOL.",0.45175824175824175,General,Retail,0.3162307692307692
84251J,"GREETING CARD, THE BLACK CAT",0.7458823529411764,General,Retail,0.5221176470588235
84255A,PINK GLASS COCKTAIL LAMP,2.1,General,Retail,1.47
84255B,ORANGE COCKTAIL GLASS LAMP,4.4911111111111115,General,Retail,3.143777777777778
84270,ASSTD DESIGN BUBBLE GUM RING,0.2478361344537815,General,Retail,0.17348529411764704
84279B,CHERRY BLOSSOM DECORATIVE FLASK,4.296511627906977,General,Retail,3.0075581395348836
84279P, CHERRY BLOSSOM  DECORATIVE FLASK,4.604666666666667,General,Retail,3.2232666666666665
84288B,SET/2 BLUE  NOODLE BASKETS,1.95,General,Retail,1.365
84292,ROSE PINK METAL FOLDING CHAIR,10.534285714285714,General,Retail,7.373999999999999
84292B,BLUE COL METAL FOLDING CHAIR,7.359999999999999,General,Retail,5.151999999999999
84306,S/3 PINK SQUARE PLANTERS ROSES,12.064193548387097,General,Retail,8.444935483870967
84311,CAMOFLAGE CUSHION COVER,1.65,General,Retail,1.1549999999999998
84313A,PINK TV TRAY TABLE ,6.26,General,Retail,4.382
84313B,BLUE TV TRAY TABLE ,6.966024096385543,General,Retail,4.87621686746988
84313C,ORANGE TV TRAY TABLE ,5.152739726027397,General,Retail,3.6069178082191775
84327A,PINK JUMPER LARRY THE LAMB,2.0976422764227642,General,Retail,1.468349593495935
84340,LARGE FIBRE OPTIC CHRISTMAS TREE,4.346363636363637,General,Retail,3.0424545454545453
84341B,SMALL PINK MAGIC CHRISTMAS TREE,0.8920799999999999,General,Retail,0.6244559999999999
84347,ROTATING SILVER ANGELS T-LIGHT HLDR,3.3425352112676054,General,Retail,2.3397746478873236
84352,SILVER CHRISTMAS TREE BAUBLE STAND ,17.837936507936508,General,Retail,12.486555555555555
84356,POMPOM CURTAIN,6.5449624060150375,General,Retail,4.581473684210526
84358,FLOOR LAMP SHADE WOOD BASE,12.642413793103447,General,Retail,8.849689655172412
84360,TABLE LAMP WHITE SHADE WOOD BASE,6.240243902439024,General,Retail,4.368170731707317
84366,VENDETTA CANVAS PICTURE,3.75,General,Retail,2.625
84367,LA STREGA CANVAS PICTURE ,2.175,General,Retail,1.5224999999999997
84371,BIG PINK POODLE,17.375,General,Retail,12.1625
84375,SET OF 20 KIDS COOKIE CUTTERS,2.5122166874221667,General,Retail,1.7585516811955166
84378,SET OF 3 HEART COOKIE CUTTERS,1.5957911392405062,General,Retail,1.1170537974683543
84380,SET OF 3 BUTTERFLY COOKIE CUTTERS,1.6672395369545858,General,Retail,1.16706767586821
84387A,BIRD ON BRANCH CANVAS SCREEN,1.95,General,Retail,1.365
84388,WISE MAN STAR SHAPE EGG PAN,1.4856521739130435,General,Retail,1.0399565217391304
84396,6 HOOK JEWELLERY STAND BLACK DRESS,5.774400000000001,General,Retail,4.04208
84402B,PURPLE DRESS JEWELLERY STAND,1.33,General,Retail,0.9309999999999999
84402D,PINK DRESS JEWELLERY STAND ,2.2946153846153847,General,Retail,1.6062307692307691
84405A,S/3 PINK COL METAL BASKET W HANDLE,11.7106,General,Retail,8.19742
84406B,CREAM CUPID HEARTS COAT HANGER,3.74048178613396,General,Retail,2.618337250293772
84406b,CREAM CUPID HEARTS COAT HANGER,6.91,General,Retail,4.837
84414B,FUSCHIA/GREEN STRIPE WOOLLY BLANKET,13.965555555555556,General,Retail,9.775888888888888
84415A,PINK FLOCK SUEDE CUSHION COVER ,2.9166666666666665,General,Retail,2.0416666666666665
84415B,BLUE FLOCK CUSHION COVER ,3.392857142857143,General,Retail,2.375
84422,PINK/BLUE DISC/MIRROR STRING,1.0126315789473683,General,Retail,0.7088421052631578
84424A,FOUR PICTURE WHITE GLASS FRAME,3.75,General,Retail,2.625
84425A,WHITE GLASS TV TRIPLE FRAME,4.2555555555555555,General,Retail,2.9788888888888887
84427B,BLACK GLASS TV DOUBLE P/FRAME 15X10,4.25,General,Retail,2.9749999999999996
84429A,MEDIUM PINK BUDDHA HEAD ,4.005,General,Retail,2.8034999999999997
84437A,S/6 PINK EASTER DECS IN BOX,0.8924999999999998,General,Retail,0.6247499999999998
84447,6 RABBIT CHAIN EASTER,1.361578947368421,General,Retail,0.9531052631578947
84450A,PINK RABBIT SITTING EASTER,0.49799999999999994,General,Retail,0.34859999999999997
84450B,YELLOW RABBIT SAT EASTER,0.722,General,Retail,0.5054
84452,METAL RABBIT LADDER EASTER ,1.1748888888888889,General,Retail,0.8224222222222222
84454,WOBBLING METAL CHICKEN EASTER,1.075,General,Retail,0.7525
84455,SET OF 3 RABBIT CARROTS EASTER,1.014,General,Retail,0.7098
84456,SET OF 3 RABBIT EGG EASTER,0.9562499999999999,General,Retail,0.6693749999999999
84457,SET/3 RABBITS FLOWER SKIPPPING ROPE,1.1467692307692305,General,Retail,0.8027384615384613
84458,S/3 RABBIT FLOWER/EGG/CARROT ROPE,0.85,General,Retail,0.595
84459A,PINK METAL CHICKEN HEART ,2.3394117647058823,General,Retail,1.6375882352941176
84459B,YELLOW METAL CHICKEN HEART ,2.115852534562212,General,Retail,1.4810967741935483
84461,12 PINK HEN+CHICKS IN BASKET,2.60775,General,Retail,1.8254249999999996
84462,3 PINK HEN+CHICKS IN BASKET,1.3264285714285715,General,Retail,0.9285
84464,S/60 PINK FLUFFY CHICKS IN BOX,2.4954545454545456,General,Retail,1.7468181818181818
84465,15 PINK FLUFFY CHICKS IN BOX,3.041739130434783,General,Retail,2.129217391304348
84466,TOP SECRET PEN SET,1.6404109589041096,General,Retail,1.1482876712328767
84467,ENGLISH ROSE DESIGN QUILTED THROW,24.040602409638552,General,Retail,16.828421686746985
84469,ROSE DES PADDED FLOOR CUSHION,5.513863636363637,General,Retail,3.8597045454545458
84472,PINK AND LILAC QUILTED THROW ,46.424,General,Retail,32.4968
84482,BUTTONS DESIGN JEWELLERY BOX,4.106666666666667,General,Retail,2.874666666666667
84493,BLUE/PINK NEST STRIPE BOX,1.5619999999999998,General,Retail,1.0933999999999997
84497,BUTTONS AND STRIPES NOTEBOOK ,4.15102564102564,General,Retail,2.905717948717948
84499,BLACK FLOWER CANDLE PLATE,1.238780487804878,General,Retail,0.8671463414634146
84507B,STRIPES DESIGN MONKEY DOLL,2.9207758620689654,General,Retail,2.0445431034482757
84507C,BLUE CIRCLES DESIGN MONKEY DOLL,2.7132394366197183,General,Retail,1.8992676056338027
84508A,CAMOFLAGE DESIGN TEDDY,2.511743119266055,General,Retail,1.7582201834862383
84508B,STRIPES DESIGN TEDDY,2.8228378378378376,General,Retail,1.9759864864864862
84508C,BLUE CIRCLES DESIGN TEDDY,2.949302325581395,General,Retail,2.0645116279069766
84509A,ENGLISH ROSE PLACEMATS,4.56210396039604,General,Retail,3.1934727722772274
84509B,FAIRY CAKE PLACEMATS,4.262878787878788,General,Retail,2.9840151515151514
84509C,DOTTY PLACEMATS ,4.392083333333333,General,Retail,3.074458333333333
84509E,CAROUSEL PLACEMATS ,4.1315625,General,Retail,2.89209375
84509F,NEW ENGLAND PLACEMATS,3.9371739130434786,General,Retail,2.7560217391304347
84509G,FAIRY CAKE PLACEMATS ,3.7734591194968554,General,Retail,2.6414213836477987
84509a,ENGLISH ROSE PLACEMATS,7.4770666666666665,General,Retail,5.233946666666666
84509b,SET OF 4 FAIRY CAKE PLACEMATS,7.46,General,Retail,5.2219999999999995
84509c,DOTTY PLACEMATS ,7.547272727272727,General,Retail,5.283090909090909
84509e,SET OF 4 CAROUSEL PLACEMATS ,7.62,General,Retail,5.334
84509g,SET OF 4 FAIRY CAKE PLACEMATS ,7.46,General,Retail,5.2219999999999995
84510A,SET OF 4 ENGLISH ROSE COASTERS,1.6820964360587003,General,Retail,1.1774675052410901
84510B,SET OF 4 FAIRY CAKES COASTERS ,1.673157894736842,General,Retail,1.1712105263157893
84510C,SET OF 4 POLKADOTS COASTERS,1.6765346534653465,General,Retail,1.1735742574257424
84510E,SET OF 4 GREEN CAROUSEL COASTERS,1.8128571428571427,General,Retail,1.269
84510F,SET OF 4 NEW ENGLAND COASTERS ,1.4618421052631578,General,Retail,1.0232894736842104
84510a,SET OF 4 ENGLISH ROSE COASTERS,2.477241379310345,General,Retail,1.7340689655172414
84510b,SET OF 4 FAIRY CAKES COASTERS ,2.15,General,Retail,1.505
84510c,SET OF 4 POLKADOTS COASTERS,2.4820588235294117,General,Retail,1.7374411764705882
84510e,SET OF 4 GREEN CAROUSEL COASTERS,2.5016666666666665,General,Retail,1.7511666666666663
84519A,TOMATO CHARLIE+LOLA COASTER SET,2.9695566502463056,General,Retail,2.078689655172414
84519B,CARROT CHARLIE+LOLA COASTER SET,2.900372093023256,General,Retail,2.030260465116279
84520B,PACK 20 ENGLISH ROSE PAPER NAPKINS,1.040450204638472,General,Retail,0.7283151432469304
84520D,PACK OF 20 FAIRY CAKE PAPER NAPKINS,1.1359574468085107,General,Retail,0.7951702127659575
84520b,PACK 20 ENGLISH ROSE PAPER NAPKINS,2.085,General,Retail,1.4594999999999998
84522,PINK PARTY SUNGLASSES,1.8596153846153847,General,Retail,1.3017307692307691
84526,GIANT BLACK SUNGLASSES,2.112058823529412,General,Retail,1.4784411764705883
84527,FLAMES SUNGLASSES PINK LENSES,2.1160869565217393,General,Retail,1.4812608695652174
84529A,PINK KNITTED KIDS RUCKSACK,6.563684210526316,General,Retail,4.59457894736842
84529B,BLUE KNITTED KID'S RUCKSACK,5.226,General,Retail,3.6582
84529C,YELLOW KNITTED KIDS RUCKSACK,5.033783783783784,General,Retail,3.5236486486486487
84531A,PINK KNITTED EGG COSY,1.294468085106383,General,Retail,0.9061276595744681
84531B,BLUE KNITTED EGG COSY,1.1726190476190477,General,Retail,0.8208333333333333
84532B,FAIRY CAKES RECTANGLUAR BOXES,7.502903225806452,General,Retail,5.252032258064516
84533B,FAIRY CAKES ROUND NESTING BOXES,7.096666666666667,General,Retail,4.967666666666666
84534B,FAIRY CAKE NOTEBOOK A5 SIZE,1.1997326203208556,General,Retail,0.8398128342245988
84534b,FAIRY CAKE NOTEBOOK A5 SIZE,1.66,General,Retail,1.162
84535A,ENGLISH ROSE NOTEBOOK A6 SIZE,0.8453846153846154,General,Retail,0.5917692307692307
84535B,FAIRY CAKES NOTEBOOK A6 SIZE,0.8490090090090091,General,Retail,0.5943063063063063
84536A,ENGLISH ROSE NOTEBOOK A7 SIZE,0.533872,General,Retail,0.3737104
84536B,FAIRY CAKES NOTEBOOK A7 SIZE,0.5752357320099255,General,Retail,0.40266501240694785
84536a,ENGLISH ROSE NOTEBOOK A7 SIZE,0.8033333333333333,General,Retail,0.5623333333333334
84536b,FAIRY CAKES NOTEBOOK A7 SIZE,0.81,General,Retail,0.567
84537B,FAIRY CAKES GIFT BAG,0.42,General,Retail,0.294
84539,KNITTED RABBIT DOLL ,1.6499999999999997,General,Retail,1.1549999999999998
84546,CROCHET POODLE KEYRING,1.6499999999999997,General,Retail,1.1549999999999998
84548,CROCHET BEAR RED/BLUE  KEYRING,1.65,General,Retail,1.1549999999999998
84549,CROCHET WHITE RABBIT KEYRING ,2.368125,General,Retail,1.6576875
84550,CROCHET LILAC/RED BEAR KEYRING,1.65,General,Retail,1.1549999999999998
84551,CROCHET DOG KEYRING,1.65,General,Retail,1.1549999999999998
84555A,YELLOW VW BEETLE CERAMIC MONEY BOX,2.926470588235294,General,Retail,2.0485294117647057
84558A,3D DOG PICTURE PLAYING CARDS,3.133529411764706,General,Retail,2.1934705882352943
84558a,3D DOG PICTURE PLAYING CARDS,5.952105263157895,General,Retail,4.166473684210526
84559A,3D SHEET OF DOG STICKERS,1.0671428571428572,General,Retail,0.747
84559B,3D SHEET OF CAT STICKERS,1.0304060913705584,General,Retail,0.7212842639593908
84559D,3D SHEET OF SEA WORLD STICKERS,0.9067741935483871,General,Retail,0.6347419354838709
84559a,3D SHEET OF DOG STICKERS,1.6787499999999997,General,Retail,1.1751249999999998
84559b,3D SHEET OF CAT STICKERS,1.6707999999999998,General,Retail,1.1695599999999997
84559d,3D SHEET OF SEA WORLD STICKERS,1.69,General,Retail,1.1829999999999998
84562A,PINK/WHITE RIBBED MELAMINE JUG,9.355443037974684,General,Retail,6.5488101265822785
84562B,BLUE/WHITE RIBBED MELAMINE JUG,10.530000000000001,General,Retail,7.371
84563A,PINK & WHITE BREAKFAST TRAY,6.021612903225806,General,Retail,4.215129032258064
84563B,BLUE & WHITE BREAKFAST TRAY,5.206271186440678,General,Retail,3.6443898305084743
84564,6 SEGMENT COLOURED SNACK BOWL ,8.725454545454546,General,Retail,6.107818181818182
84567,FROSTED GLASS WITH SILVER SURROUND,1.65,General,Retail,1.1549999999999998
